{
  "covariance": {
    "kernel": "bartlett",
    "maxlags": 17,
    "type": "HAC"
  },
  "design_matrix": {
    "columns": 14,
    "rank": 14
  },
  "request_id": "tsd-request-4ac79a1a6ebcf54b54441e27454cef89",
  "sample_alignment": {
    "common_nobs": 67,
    "dropped_for_lags": 4,
    "dropped_for_leads": 17,
    "dropped_for_missing": 0,
    "end": "2007Q4",
    "original_nobs": 88,
    "start": "1986Q1"
  },
  "schema_version": "0.1.0",
  "warnings": [
    "effective sample varies by horizon"
  ]
}
