{
  "covariance": {
    "kernel": "bartlett",
    "maxlags": 17,
    "type": "HAC"
  },
  "design_matrix": {
    "columns": 14,
    "rank": 14
  },
  "request_id": "tsd-request-3a0e72ad4d76d2df661f8835ccea7b8e",
  "sample_alignment": {
    "common_nobs": 71,
    "dropped_for_lags": 4,
    "dropped_for_leads": 17,
    "dropped_for_missing": 0,
    "end": "2007Q4",
    "original_nobs": 92,
    "start": "1985Q1"
  },
  "schema_version": "0.1.0",
  "warnings": []
}
